{
  "id": "example-v3-first-marker-exact",
  "agentId": "example-agent",
  "route": {
    "stances": [
      {
        "label": "base-pickup",
        "cell": {
          "x": -20682,
          "y": 119,
          "z": -33529
        }
      },
      {
        "cell": {
          "x": -20681,
          "y": 119,
          "z": -33529
        }
      },
      {
        "cell": {
          "x": -20680,
          "y": 120,
          "z": -33529
        }
      },
      {
        "cell": {
          "x": -20679,
          "y": 120,
          "z": -33529
        }
      },
      {
        "cell": {
          "x": -20678,
          "y": 120,
          "z": -33529
        }
      },
      {
        "cell": {
          "x": -20677,
          "y": 121,
          "z": -33529
        }
      },
      {
        "cell": {
          "x": -20676,
          "y": 121,
          "z": -33529
        }
      },
      {
        "cell": {
          "x": -20675,
          "y": 121,
          "z": -33529
        }
      },
      {
        "cell": {
          "x": -20674,
          "y": 121,
          "z": -33529
        }
      },
      {
        "cell": {
          "x": -20673,
          "y": 121,
          "z": -33529
        }
      },
      {
        "cell": {
          "x": -20672,
          "y": 122,
          "z": -33529
        }
      },
      {
        "cell": {
          "x": -20671,
          "y": 122,
          "z": -33529
        }
      },
      {
        "cell": {
          "x": -20670,
          "y": 122,
          "z": -33529
        }
      },
      {
        "cell": {
          "x": -20669,
          "y": 122,
          "z": -33529
        }
      },
      {
        "cell": {
          "x": -20668,
          "y": 122,
          "z": -33529
        }
      },
      {
        "cell": {
          "x": -20667,
          "y": 122,
          "z": -33529
        }
      },
      {
        "cell": {
          "x": -20666,
          "y": 122,
          "z": -33529
        }
      },
      {
        "cell": {
          "x": -20665,
          "y": 123,
          "z": -33529
        }
      },
      {
        "cell": {
          "x": -20664,
          "y": 123,
          "z": -33529
        }
      },
      {
        "cell": {
          "x": -20663,
          "y": 123,
          "z": -33529
        }
      },
      {
        "cell": {
          "x": -20662,
          "y": 123,
          "z": -33529
        }
      },
      {
        "cell": {
          "x": -20661,
          "y": 123,
          "z": -33529
        }
      },
      {
        "cell": {
          "x": -20660,
          "y": 123,
          "z": -33529
        }
      },
      {
        "cell": {
          "x": -20659,
          "y": 123,
          "z": -33529
        }
      },
      {
        "cell": {
          "x": -20658,
          "y": 123,
          "z": -33529
        }
      },
      {
        "cell": {
          "x": -20657,
          "y": 123,
          "z": -33529
        }
      },
      {
        "cell": {
          "x": -20656,
          "y": 123,
          "z": -33529
        }
      },
      {
        "cell": {
          "x": -20655,
          "y": 123,
          "z": -33529
        }
      },
      {
        "cell": {
          "x": -20654,
          "y": 124,
          "z": -33529
        }
      },
      {
        "cell": {
          "x": -20653,
          "y": 124,
          "z": -33529
        }
      },
      {
        "cell": {
          "x": -20652,
          "y": 124,
          "z": -33529
        }
      },
      {
        "cell": {
          "x": -20651,
          "y": 124,
          "z": -33529
        }
      },
      {
        "cell": {
          "x": -20650,
          "y": 124,
          "z": -33529
        }
      },
      {
        "cell": {
          "x": -20649,
          "y": 125,
          "z": -33529
        }
      },
      {
        "cell": {
          "x": -20648,
          "y": 125,
          "z": -33529
        }
      },
      {
        "cell": {
          "x": -20647,
          "y": 125,
          "z": -33529
        }
      },
      {
        "cell": {
          "x": -20646,
          "y": 125,
          "z": -33529
        }
      },
      {
        "cell": {
          "x": -20645,
          "y": 125,
          "z": -33529
        }
      },
      {
        "cell": {
          "x": -20644,
          "y": 125,
          "z": -33529
        }
      },
      {
        "cell": {
          "x": -20643,
          "y": 125,
          "z": -33529
        }
      },
      {
        "cell": {
          "x": -20642,
          "y": 125,
          "z": -33529
        }
      },
      {
        "cell": {
          "x": -20641,
          "y": 125,
          "z": -33529
        }
      },
      {
        "cell": {
          "x": -20640,
          "y": 126,
          "z": -33529
        }
      },
      {
        "cell": {
          "x": -20639,
          "y": 125,
          "z": -33529
        }
      },
      {
        "cell": {
          "x": -20638,
          "y": 126,
          "z": -33529
        }
      },
      {
        "cell": {
          "x": -20637,
          "y": 126,
          "z": -33529
        }
      },
      {
        "cell": {
          "x": -20636,
          "y": 126,
          "z": -33529
        }
      },
      {
        "cell": {
          "x": -20635,
          "y": 126,
          "z": -33529
        }
      },
      {
        "cell": {
          "x": -20634,
          "y": 126,
          "z": -33529
        }
      },
      {
        "cell": {
          "x": -20633,
          "y": 126,
          "z": -33529
        }
      },
      {
        "cell": {
          "x": -20632,
          "y": 126,
          "z": -33529
        }
      },
      {
        "cell": {
          "x": -20631,
          "y": 127,
          "z": -33529
        }
      },
      {
        "cell": {
          "x": -20630,
          "y": 127,
          "z": -33529
        }
      },
      {
        "cell": {
          "x": -20629,
          "y": 127,
          "z": -33529
        }
      },
      {
        "cell": {
          "x": -20628,
          "y": 127,
          "z": -33529
        }
      },
      {
        "cell": {
          "x": -20627,
          "y": 128,
          "z": -33529
        }
      },
      {
        "cell": {
          "x": -20626,
          "y": 128,
          "z": -33529
        }
      },
      {
        "cell": {
          "x": -20625,
          "y": 128,
          "z": -33529
        }
      },
      {
        "cell": {
          "x": -20624,
          "y": 129,
          "z": -33529
        }
      },
      {
        "cell": {
          "x": -20623,
          "y": 129,
          "z": -33529
        }
      },
      {
        "cell": {
          "x": -20622,
          "y": 129,
          "z": -33529
        }
      },
      {
        "cell": {
          "x": -20621,
          "y": 129,
          "z": -33529
        }
      },
      {
        "cell": {
          "x": -20620,
          "y": 129,
          "z": -33529
        }
      },
      {
        "cell": {
          "x": -20619,
          "y": 130,
          "z": -33529
        }
      },
      {
        "cell": {
          "x": -20618,
          "y": 130,
          "z": -33529
        }
      },
      {
        "cell": {
          "x": -20617,
          "y": 130,
          "z": -33529
        }
      },
      {
        "cell": {
          "x": -20616,
          "y": 130,
          "z": -33529
        }
      },
      {
        "cell": {
          "x": -20615,
          "y": 130,
          "z": -33529
        }
      },
      {
        "cell": {
          "x": -20614,
          "y": 130,
          "z": -33529
        }
      },
      {
        "cell": {
          "x": -20613,
          "y": 131,
          "z": -33529
        }
      },
      {
        "cell": {
          "x": -20612,
          "y": 131,
          "z": -33529
        }
      },
      {
        "cell": {
          "x": -20611,
          "y": 131,
          "z": -33529
        }
      },
      {
        "cell": {
          "x": -20610,
          "y": 131,
          "z": -33529
        }
      },
      {
        "cell": {
          "x": -20609,
          "y": 131,
          "z": -33529
        }
      },
      {
        "cell": {
          "x": -20608,
          "y": 131,
          "z": -33529
        }
      },
      {
        "cell": {
          "x": -20607,
          "y": 131,
          "z": -33529
        }
      },
      {
        "cell": {
          "x": -20606,
          "y": 131,
          "z": -33529
        }
      },
      {
        "cell": {
          "x": -20605,
          "y": 131,
          "z": -33529
        }
      },
      {
        "cell": {
          "x": -20604,
          "y": 131,
          "z": -33529
        }
      },
      {
        "cell": {
          "x": -20603,
          "y": 131,
          "z": -33529
        }
      },
      {
        "cell": {
          "x": -20602,
          "y": 132,
          "z": -33529
        }
      },
      {
        "cell": {
          "x": -20601,
          "y": 132,
          "z": -33529
        }
      },
      {
        "cell": {
          "x": -20600,
          "y": 132,
          "z": -33529
        }
      },
      {
        "cell": {
          "x": -20599,
          "y": 132,
          "z": -33529
        }
      },
      {
        "cell": {
          "x": -20598,
          "y": 132,
          "z": -33529
        }
      },
      {
        "cell": {
          "x": -20597,
          "y": 132,
          "z": -33529
        }
      },
      {
        "cell": {
          "x": -20596,
          "y": 133,
          "z": -33529
        }
      },
      {
        "cell": {
          "x": -20595,
          "y": 133,
          "z": -33529
        }
      },
      {
        "cell": {
          "x": -20594,
          "y": 133,
          "z": -33529
        }
      },
      {
        "cell": {
          "x": -20593,
          "y": 133,